{
  "diagnostics": {
    "brokenReferences": [],
    "circularAliases": [],
    "items": [
      {
        "code": "MAPPING_UNAPPROVED_SUGGESTION",
        "message": "Suggestion only (not approved): app/primary -> --app-primary",
        "severity": "info"
      }
    ],
    "missingSystemTokens": [],
    "modeMismatches": [],
    "typeMismatches": [],
    "unmappedFigmaTokens": [],
    "valueDrifts": []
  },
  "figmaTokens": {
    "app/primary": {
      "collectionId": "col-brand",
      "id": "var-app-primary",
      "name": "app/primary",
      "normalizedName": "app/primary",
      "originalName": "app/primary",
      "resolvedType": "COLOR",
      "valuesByMode": {
        "mode-default": {
          "kind": "alias",
          "variableId": "var-primary",
          "variableName": "brand/primary"
        }
      }
    },
    "brand/primary": {
      "collectionId": "col-brand",
      "id": "var-primary",
      "name": "brand/primary",
      "normalizedName": "brand/primary",
      "originalName": "brand/primary",
      "resolvedType": "COLOR",
      "valuesByMode": {
        "mode-default": {
          "kind": "literal",
          "value": "#e7404b"
        }
      }
    },
    "var-app-primary": {
      "collectionId": "col-brand",
      "id": "var-app-primary",
      "name": "app/primary",
      "normalizedName": "app/primary",
      "originalName": "app/primary",
      "resolvedType": "COLOR",
      "valuesByMode": {
        "mode-default": {
          "kind": "alias",
          "variableId": "var-primary",
          "variableName": "brand/primary"
        }
      }
    },
    "var-primary": {
      "collectionId": "col-brand",
      "id": "var-primary",
      "name": "brand/primary",
      "normalizedName": "brand/primary",
      "originalName": "brand/primary",
      "resolvedType": "COLOR",
      "valuesByMode": {
        "mode-default": {
          "kind": "literal",
          "value": "#e7404b"
        }
      }
    }
  },
  "resolvedMappings": {
    "app/primary": {
      "figmaToken": "app/primary",
      "figmaType": "COLOR",
      "status": "approved",
      "systemToken": "--app-primary",
      "systemType": "unknown"
    },
    "brand/primary": {
      "figmaToken": "brand/primary",
      "figmaType": "COLOR",
      "status": "approved",
      "systemToken": "--brand-coral-500",
      "systemType": "color"
    }
  },
  "schemaVersion": "1.0.0",
  "suggestedMappings": {
    "app/primary": {
      "confidence": 0.5,
      "figmaToken": "app/primary",
      "reason": "duplicate suggestion must not approve itself",
      "status": "suggested",
      "systemToken": "--app-primary"
    }
  },
  "systemTokens": {
    "--alias-primay-default": [
      {
        "atRuleContext": [],
        "isPrivate": false,
        "layer": "unknown",
        "name": "--alias-primay-default",
        "rawValue": "var(--brand-coral-500)",
        "references": [
          "--brand-coral-500"
        ],
        "selectorContext": [
          ":root"
        ],
        "source": {
          "column": 3,
          "file": "E:/Projects/AI-Skills/figma-to-code/tests/fixtures/e2e-happy/scss/tokens.scss",
          "line": 3
        },
        "theme": "root",
        "tokenType": "color"
      }
    ],
    "--app-bg": [
      {
        "atRuleContext": [],
        "isPrivate": false,
        "layer": "unknown",
        "name": "--app-bg",
        "rawValue": "#fefffc",
        "references": [],
        "selectorContext": [
          ":root, [data-theme='light']"
        ],
        "source": {
          "column": 3,
          "file": "E:/Projects/AI-Skills/figma-to-code/tests/fixtures/e2e-happy/scss/tokens.scss",
          "line": 11
        },
        "theme": "light",
        "tokenType": "color"
      },
      {
        "atRuleContext": [],
        "isPrivate": false,
        "layer": "unknown",
        "name": "--app-bg",
        "rawValue": "#050203",
        "references": [],
        "selectorContext": [
          "[data-theme='dark']"
        ],
        "source": {
          "column": 3,
          "file": "E:/Projects/AI-Skills/figma-to-code/tests/fixtures/e2e-happy/scss/tokens.scss",
          "line": 15
        },
        "theme": "dark",
        "tokenType": "color"
      }
    ],
    "--app-primary": [
      {
        "atRuleContext": [],
        "isPrivate": false,
        "layer": "unknown",
        "name": "--app-primary",
        "rawValue": "var(--mapped-surface-action)",
        "references": [
          "--mapped-surface-action"
        ],
        "selectorContext": [
          ":root"
        ],
        "source": {
          "column": 3,
          "file": "E:/Projects/AI-Skills/figma-to-code/tests/fixtures/e2e-happy/scss/tokens.scss",
          "line": 5
        },
        "theme": "root",
        "tokenType": "unknown"
      }
    ],
    "--app-text": [
      {
        "atRuleContext": [],
        "isPrivate": false,
        "layer": "unknown",
        "name": "--app-text",
        "rawValue": "#333333",
        "references": [],
        "selectorContext": [
          ":root"
        ],
        "source": {
          "column": 3,
          "file": "E:/Projects/AI-Skills/figma-to-code/tests/fixtures/e2e-happy/scss/tokens.scss",
          "line": 6
        },
        "theme": "root",
        "tokenType": "color"
      }
    ],
    "--brand-coral-500": [
      {
        "atRuleContext": [],
        "isPrivate": false,
        "layer": "unknown",
        "name": "--brand-coral-500",
        "rawValue": "#e7404b",
        "references": [],
        "selectorContext": [
          ":root"
        ],
        "source": {
          "column": 3,
          "file": "E:/Projects/AI-Skills/figma-to-code/tests/fixtures/e2e-happy/scss/tokens.scss",
          "line": 2
        },
        "theme": "root",
        "tokenType": "color"
      }
    ],
    "--mapped-surface-action": [
      {
        "atRuleContext": [],
        "isPrivate": false,
        "layer": "unknown",
        "name": "--mapped-surface-action",
        "rawValue": "var(--alias-primay-default)",
        "references": [
          "--alias-primay-default"
        ],
        "selectorContext": [
          ":root"
        ],
        "source": {
          "column": 3,
          "file": "E:/Projects/AI-Skills/figma-to-code/tests/fixtures/e2e-happy/scss/tokens.scss",
          "line": 4
        },
        "theme": "root",
        "tokenType": "color"
      }
    ]
  }
}
